{
  "submission_type": "decision",
  "team_id": "00000000-0000-4000-8000-000000000000",
  "team_token": "REPLACE_WITH_TEAM_TOKEN_FROM_REGISTRATION",
  "phase": "official",
  "round_id": "official-2026-10-12-r1",
  "weights": {
    "AAPL": 0.2,
    "MSFT": 0.2,
    "NVDA": 0.2,
    "INTC": 0,
    "CRM": 0,
    "JPM": 0,
    "BAC": 0,
    "GS": 0,
    "V": 0,
    "PYPL": 0,
    "LLY": 0,
    "JNJ": 0,
    "UNH": 0,
    "PFE": 0,
    "TMO": 0,
    "AMZN": 0,
    "TSLA": 0,
    "WMT": 0,
    "NKE": 0,
    "KO": 0,
    "CAT": 0,
    "GE": 0,
    "BA": 0,
    "XOM": 0,
    "CVX": 0,
    "GOOGL": 0,
    "META": 0,
    "DIS": 0,
    "T": 0,
    "NEE": 0
  }
}
